[{"author":[{"given":"Mark","family":"Chen"},{"given":"Jerry","family":"Tworek"},{"given":"Heewoo","family":"Jun"},{"given":"Qiming","family":"Yuan"},{"given":"Henrique Ponde de Oliveira","family":"Pinto"},{"given":"Jared","family":"Kaplan"},{"given":"Harri","family":"Edwards"},{"given":"Yuri","family":"Burda"},{"given":"Nicholas","family":"Joseph"},{"given":"Greg","family":"Brockman"},{"given":"Alex","family":"Ray"},{"given":"Raul","family":"Puri"},{"given":"Gretchen","family":"Krueger"},{"given":"Michael","family":"Petrov"},{"given":"Heidy","family":"Khlaaf"},{"given":"Girish","family":"Sastry"},{"given":"Pamela","family":"Mishkin"},{"given":"Brooke","family":"Chan"},{"given":"Scott","family":"Gray"},{"given":"Nick","family":"Ryder"},{"given":"Mikhail","family":"Pavlov"},{"given":"Alethea","family":"Power"},{"given":"Lukasz","family":"Kaiser"},{"given":"Mohammad","family":"Bavarian"},{"given":"Clemens","family":"Winter"},{"given":"Philippe","family":"Tillet"},{"given":"Felipe Petroski","family":"Such"},{"given":"Dave","family":"Cummings"},{"given":"Matthias","family":"Plappert"},{"given":"Fotios","family":"Chantzis"},{"given":"Elizabeth","family":"Barnes"},{"given":"Ariel","family":"Herbert-Voss"},{"given":"William Hebgen","family":"Guss"},{"given":"Alex","family":"Nichol"},{"given":"Alex","family":"Paino"},{"given":"Nikolas","family":"Tezak"},{"given":"Jie","family":"Tang"},{"given":"Igor","family":"Babuschkin"},{"given":"Suchir","family":"Balaji"},{"given":"Shantanu","family":"Jain"},{"given":"William","family":"Saunders"},{"given":"Christopher","family":"Hesse"},{"given":"Andrew N.","family":"Carr"},{"given":"Jan","family":"Leike"},{"given":"Josh","family":"Achiam"},{"given":"Vedant","family":"Misra"},{"given":"Evan","family":"Morikawa"},{"given":"Alec","family":"Radford"},{"given":"Matthew","family":"Knight"},{"given":"Miles","family":"Brundage"},{"given":"Mira","family":"Murati"},{"given":"Katie","family":"Mayer"},{"given":"Peter","family":"Welinder"},{"given":"Bob","family":"McGrew"},{"given":"Dario","family":"Amodei"},{"given":"Sam","family":"McCandlish"},{"given":"Ilya","family":"Sutskever"},{"given":"Wojciech","family":"Zaremba"}],"DOI":"10.48550/ARXIV.2107.03374","type":"document","id":"https://doi.org/10.48550/arxiv.2107.03374","citation-key":"https://doi.org/10.48550/arxiv.2107.03374","issued":{"date-parts":[[2021]]},"keyword":"Machine Learning (cs.LG),FOS: Computer and information sciences,FOS: Computer and information sciences","publisher":"arXiv","title":"Evaluating Large Language Models Trained on Code","URL":"https://arxiv.org/abs/2107.03374","_graph":[{"type":"@biblatex/text","data":"@misc{https://doi.org/10.48550/arxiv.2107.03374,\n  doi = {10.48550/ARXIV.2107.03374},\n  url = {https://arxiv.org/abs/2107.03374},\n  author = {Chen, Mark and Tworek, Jerry and Jun, Heewoo and Yuan, Qiming and Pinto, Henrique Ponde de Oliveira and Kaplan, Jared and Edwards, Harri and Burda, Yuri and Joseph, Nicholas and Brockman, Greg and Ray, Alex and Puri, Raul and Krueger, Gretchen and Petrov, Michael and Khlaaf, Heidy and Sastry, Girish and Mishkin, Pamela and Chan, Brooke and Gray, Scott and Ryder, Nick and Pavlov, Mikhail and Power, Alethea and Kaiser, Lukasz and Bavarian, Mohammad and Winter, Clemens and Tillet, Philippe and Such, Felipe Petroski and Cummings, Dave and Plappert, Matthias and Chantzis, Fotios and Barnes, Elizabeth and Herbert-Voss, Ariel and Guss, William Hebgen and Nichol, Alex and Paino, Alex and Tezak, Nikolas and Tang, Jie and Babuschkin, Igor and Balaji, Suchir and Jain, Shantanu and Saunders, William and Hesse, Christopher and Carr, Andrew N. and Leike, Jan and Achiam, Josh and Misra, Vedant and Morikawa, Evan and Radford, Alec and Knight, Matthew and Brundage, Miles and Murati, Mira and Mayer, Katie and Welinder, Peter and McGrew, Bob and Amodei, Dario and McCandlish, Sam and Sutskever, Ilya and Zaremba, Wojciech},\n  keywords = {Machine Learning (cs.LG), FOS: Computer and information sciences, FOS: Computer and information sciences},\n  title = {Evaluating Large Language Models Trained on Code},\n  publisher = {arXiv},\n  year = {2021},\n  copyright = {arXiv.org perpetual, non-exclusive license}\n}\n"},{"type":"@biblatex/entries+list"},{"type":"@csl/list+object"}]}]