[{"author":[{"given":"Matthias","family":"Gerstgrasser"},{"given":"Rylan","family":"Schaeffer"},{"given":"Apratim","family":"Dey"},{"given":"Rafael","family":"Rafailov"},{"given":"Henry","family":"Sleight"},{"given":"John","family":"Hughes"},{"given":"Tomasz","family":"Korbak"},{"given":"Rajashree","family":"Agrawal"},{"given":"Dhruv","family":"Pai"},{"given":"Andrey","family":"Gromov"},{"given":"Daniel A.","family":"Roberts"},{"given":"Diyi","family":"Yang"},{"given":"David L.","family":"Donoho"},{"given":"Sanmi","family":"Koyejo"}],"DOI":"10.48550/ARXIV.2404.01413","type":"document","id":"https://doi.org/10.48550/arxiv.2404.01413","citation-key":"https://doi.org/10.48550/arxiv.2404.01413","issued":{"date-parts":[[2024]]},"keyword":"Machine Learning (cs.LG),Artificial Intelligence (cs.AI),Computation and Language (cs.CL),Emerging Technologies (cs.ET),Machine Learning (stat.ML),FOS: Computer and information sciences,FOS: Computer and information sciences","publisher":"arXiv","title":"Is Model Collapse Inevitable? Breaking the Curse of Recursion by Accumulating Real and Synthetic Data","URL":"https://arxiv.org/abs/2404.01413","_graph":[{"type":"@biblatex/text","data":"@misc{https://doi.org/10.48550/arxiv.2404.01413,\n  doi = {10.48550/ARXIV.2404.01413},\n  url = {https://arxiv.org/abs/2404.01413},\n  author = {Gerstgrasser, Matthias and Schaeffer, Rylan and Dey, Apratim and Rafailov, Rafael and Sleight, Henry and Hughes, John and Korbak, Tomasz and Agrawal, Rajashree and Pai, Dhruv and Gromov, Andrey and Roberts, Daniel A. and Yang, Diyi and Donoho, David L. and Koyejo, Sanmi},\n  keywords = {Machine Learning (cs.LG), Artificial Intelligence (cs.AI), Computation and Language (cs.CL), Emerging Technologies (cs.ET), Machine Learning (stat.ML), FOS: Computer and information sciences, FOS: Computer and information sciences},\n  title = {Is Model Collapse Inevitable? Breaking the Curse of Recursion by Accumulating Real and Synthetic Data},\n  publisher = {arXiv},\n  year = {2024},\n  copyright = {arXiv.org perpetual, non-exclusive license}\n}\n"},{"type":"@biblatex/entries+list"},{"type":"@csl/list+object"}]}]