[{"author":[{"given":"Hugo","family":"Touvron"},{"given":"Louis","family":"Martin"},{"given":"Kevin","family":"Stone"},{"given":"Peter","family":"Albert"},{"given":"Amjad","family":"Almahairi"},{"given":"Yasmine","family":"Babaei"},{"given":"Nikolay","family":"Bashlykov"},{"given":"Soumya","family":"Batra"},{"given":"Prajjwal","family":"Bhargava"},{"given":"Shruti","family":"Bhosale"},{"given":"Dan","family":"Bikel"},{"given":"Lukas","family":"Blecher"},{"given":"Cristian Canton","family":"Ferrer"},{"given":"Moya","family":"Chen"},{"given":"Guillem","family":"Cucurull"},{"given":"David","family":"Esiobu"},{"given":"Jude","family":"Fernandes"},{"given":"Jeremy","family":"Fu"},{"given":"Wenyin","family":"Fu"},{"given":"Brian","family":"Fuller"},{"given":"Cynthia","family":"Gao"},{"given":"Vedanuj","family":"Goswami"},{"given":"Naman","family":"Goyal"},{"given":"Anthony","family":"Hartshorn"},{"given":"Saghar","family":"Hosseini"},{"given":"Rui","family":"Hou"},{"given":"Hakan","family":"Inan"},{"given":"Marcin","family":"Kardas"},{"given":"Viktor","family":"Kerkez"},{"given":"Madian","family":"Khabsa"},{"given":"Isabel","family":"Kloumann"},{"given":"Artem","family":"Korenev"},{"given":"Punit Singh","family":"Koura"},{"given":"Marie-Anne","family":"Lachaux"},{"given":"Thibaut","family":"Lavril"},{"given":"Jenya","family":"Lee"},{"given":"Diana","family":"Liskovich"},{"given":"Yinghai","family":"Lu"},{"given":"Yuning","family":"Mao"},{"given":"Xavier","family":"Martinet"},{"given":"Todor","family":"Mihaylov"},{"given":"Pushkar","family":"Mishra"},{"given":"Igor","family":"Molybog"},{"given":"Yixin","family":"Nie"},{"given":"Andrew","family":"Poulton"},{"given":"Jeremy","family":"Reizenstein"},{"given":"Rashi","family":"Rungta"},{"given":"Kalyan","family":"Saladi"},{"given":"Alan","family":"Schelten"},{"given":"Ruan","family":"Silva"},{"given":"Eric Michael","family":"Smith"},{"given":"Ranjan","family":"Subramanian"},{"given":"Xiaoqing Ellen","family":"Tan"},{"given":"Binh","family":"Tang"},{"given":"Ross","family":"Taylor"},{"given":"Adina","family":"Williams"},{"given":"Jian Xiang","family":"Kuan"},{"given":"Puxin","family":"Xu"},{"given":"Zheng","family":"Yan"},{"given":"Iliyan","family":"Zarov"},{"given":"Yuchen","family":"Zhang"},{"given":"Angela","family":"Fan"},{"given":"Melanie","family":"Kambadur"},{"given":"Sharan","family":"Narang"},{"given":"Aurelien","family":"Rodriguez"},{"given":"Robert","family":"Stojnic"},{"given":"Sergey","family":"Edunov"},{"given":"Thomas","family":"Scialom"}],"DOI":"10.48550/ARXIV.2307.09288","type":"document","id":"https://doi.org/10.48550/arxiv.2307.09288","citation-key":"https://doi.org/10.48550/arxiv.2307.09288","issued":{"date-parts":[[2023]]},"keyword":"Computation and Language (cs.CL),Artificial Intelligence (cs.AI),FOS: Computer and information sciences,FOS: Computer and information sciences","publisher":"arXiv","title":"Llama 2: Open Foundation and Fine-Tuned Chat Models","URL":"https://arxiv.org/abs/2307.09288","_graph":[{"type":"@biblatex/text","data":"@misc{https://doi.org/10.48550/arxiv.2307.09288,\n  doi = {10.48550/ARXIV.2307.09288},\n  url = {https://arxiv.org/abs/2307.09288},\n  author = {Touvron, Hugo and Martin, Louis and Stone, Kevin and Albert, Peter and Almahairi, Amjad and Babaei, Yasmine and Bashlykov, Nikolay and Batra, Soumya and Bhargava, Prajjwal and Bhosale, Shruti and Bikel, Dan and Blecher, Lukas and Ferrer, Cristian Canton and Chen, Moya and Cucurull, Guillem and Esiobu, David and Fernandes, Jude and Fu, Jeremy and Fu, Wenyin and Fuller, Brian and Gao, Cynthia and Goswami, Vedanuj and Goyal, Naman and Hartshorn, Anthony and Hosseini, Saghar and Hou, Rui and Inan, Hakan and Kardas, Marcin and Kerkez, Viktor and Khabsa, Madian and Kloumann, Isabel and Korenev, Artem and Koura, Punit Singh and Lachaux, Marie-Anne and Lavril, Thibaut and Lee, Jenya and Liskovich, Diana and Lu, Yinghai and Mao, Yuning and Martinet, Xavier and Mihaylov, Todor and Mishra, Pushkar and Molybog, Igor and Nie, Yixin and Poulton, Andrew and Reizenstein, Jeremy and Rungta, Rashi and Saladi, Kalyan and Schelten, Alan and Silva, Ruan and Smith, Eric Michael and Subramanian, Ranjan and Tan, Xiaoqing Ellen and Tang, Binh and Taylor, Ross and Williams, Adina and Kuan, Jian Xiang and Xu, Puxin and Yan, Zheng and Zarov, Iliyan and Zhang, Yuchen and Fan, Angela and Kambadur, Melanie and Narang, Sharan and Rodriguez, Aurelien and Stojnic, Robert and Edunov, Sergey and Scialom, Thomas},\n  keywords = {Computation and Language (cs.CL), Artificial Intelligence (cs.AI), FOS: Computer and information sciences, FOS: Computer and information sciences},\n  title = {Llama 2: Open Foundation and Fine-Tuned Chat Models},\n  publisher = {arXiv},\n  year = {2023},\n  copyright = {arXiv.org perpetual, non-exclusive license}\n}\n"},{"type":"@biblatex/entries+list"},{"type":"@csl/list+object"}]}]