[{"author":[{"given":"Long","family":"Ouyang"},{"given":"Jeff","family":"Wu"},{"given":"Xu","family":"Jiang"},{"given":"Diogo","family":"Almeida"},{"given":"Carroll L.","family":"Wainwright"},{"given":"Pamela","family":"Mishkin"},{"given":"Chong","family":"Zhang"},{"given":"Sandhini","family":"Agarwal"},{"given":"Katarina","family":"Slama"},{"given":"Alex","family":"Ray"},{"given":"John","family":"Schulman"},{"given":"Jacob","family":"Hilton"},{"given":"Fraser","family":"Kelton"},{"given":"Luke","family":"Miller"},{"given":"Maddie","family":"Simens"},{"given":"Amanda","family":"Askell"},{"given":"Peter","family":"Welinder"},{"given":"Paul","family":"Christiano"},{"given":"Jan","family":"Leike"},{"given":"Ryan","family":"Lowe"}],"DOI":"10.48550/ARXIV.2203.02155","type":"document","id":"https://doi.org/10.48550/arxiv.2203.02155","citation-key":"https://doi.org/10.48550/arxiv.2203.02155","issued":{"date-parts":[[2022]]},"keyword":"Computation and Language (cs.CL),Artificial Intelligence (cs.AI),Machine Learning (cs.LG),FOS: Computer and information sciences,FOS: Computer and information sciences","publisher":"arXiv","title":"Training language models to follow instructions with human feedback","URL":"https://arxiv.org/abs/2203.02155","_graph":[{"type":"@biblatex/text","data":"@misc{https://doi.org/10.48550/arxiv.2203.02155,\n  doi = {10.48550/ARXIV.2203.02155},\n  url = {https://arxiv.org/abs/2203.02155},\n  author = {Ouyang, Long and Wu, Jeff and Jiang, Xu and Almeida, Diogo and Wainwright, Carroll L. and Mishkin, Pamela and Zhang, Chong and Agarwal, Sandhini and Slama, Katarina and Ray, Alex and Schulman, John and Hilton, Jacob and Kelton, Fraser and Miller, Luke and Simens, Maddie and Askell, Amanda and Welinder, Peter and Christiano, Paul and Leike, Jan and Lowe, Ryan},\n  keywords = {Computation and Language (cs.CL), Artificial Intelligence (cs.AI), Machine Learning (cs.LG), FOS: Computer and information sciences, FOS: Computer and information sciences},\n  title = {Training language models to follow instructions with human feedback},\n  publisher = {arXiv},\n  year = {2022},\n  copyright = {arXiv.org perpetual, non-exclusive license}\n}\n"},{"type":"@biblatex/entries+list"},{"type":"@csl/list+object"}]}]