[{"author":[{"given":"Yizhi","family":"Li"},{"given":"Ruibin","family":"Yuan"},{"given":"Ge","family":"Zhang"},{"given":"Yinghao","family":"Ma"},{"given":"Chenghua","family":"Lin"},{"given":"Xingran","family":"Chen"},{"given":"Anton","family":"Ragni"},{"given":"Hanzhi","family":"Yin"},{"given":"Zhijie","family":"Hu"},{"given":"Haoyu","family":"He"},{"given":"Emmanouil","family":"Benetos"},{"given":"Norbert","family":"Gyenge"},{"given":"Ruibo","family":"Liu"},{"given":"Jie","family":"Fu"}],"DOI":"10.48550/ARXIV.2212.02508","type":"document","id":"https://doi.org/10.48550/arxiv.2212.02508","citation-key":"https://doi.org/10.48550/arxiv.2212.02508","issued":{"date-parts":[[2022]]},"keyword":"Sound (cs.SD),Artificial Intelligence (cs.AI),Machine Learning (cs.LG),Multimedia (cs.MM),Audio and Speech Processing (eess.AS),FOS: Computer and information sciences,FOS: Computer and information sciences,FOS: Electrical engineering,electronic engineering,information engineering,FOS: Electrical engineering,electronic engineering,information engineering","publisher":"arXiv","title":"MAP-Music2Vec: A Simple and Effective Baseline for Self-Supervised Music Audio Representation Learning","URL":"https://arxiv.org/abs/2212.02508","_graph":[{"type":"@biblatex/text","data":"@misc{https://doi.org/10.48550/arxiv.2212.02508,\n  doi = {10.48550/ARXIV.2212.02508},\n  url = {https://arxiv.org/abs/2212.02508},\n  author = {Li, Yizhi and Yuan, Ruibin and Zhang, Ge and Ma, Yinghao and Lin, Chenghua and Chen, Xingran and Ragni, Anton and Yin, Hanzhi and Hu, Zhijie and He, Haoyu and Benetos, Emmanouil and Gyenge, Norbert and Liu, Ruibo and Fu, Jie},\n  keywords = {Sound (cs.SD), Artificial Intelligence (cs.AI), Machine Learning (cs.LG), Multimedia (cs.MM), Audio and Speech Processing (eess.AS), FOS: Computer and information sciences, FOS: Computer and information sciences, FOS: Electrical engineering, electronic engineering, information engineering, FOS: Electrical engineering, electronic engineering, information engineering},\n  title = {MAP-Music2Vec: A Simple and Effective Baseline for Self-Supervised Music Audio Representation Learning},\n  publisher = {arXiv},\n  year = {2022},\n  copyright = {arXiv.org perpetual, non-exclusive license}\n}\n"},{"type":"@biblatex/entries+list"},{"type":"@csl/list+object"}]}]