[{"author":[{"given":"Jinhyuk","family":"Lee"},{"given":"Zhuyun","family":"Dai"},{"given":"Xiaoqi","family":"Ren"},{"given":"Blair","family":"Chen"},{"given":"Daniel","family":"Cer"},{"given":"Jeremy R.","family":"Cole"},{"given":"Kai","family":"Hui"},{"given":"Michael","family":"Boratko"},{"given":"Rajvi","family":"Kapadia"},{"given":"Wen","family":"Ding"},{"given":"Yi","family":"Luan"},{"given":"Sai Meher Karthik","family":"Duddu"},{"given":"Gustavo Hernandez","family":"Abrego"},{"given":"Weiqiang","family":"Shi"},{"given":"Nithi","family":"Gupta"},{"given":"Aditya","family":"Kusupati"},{"given":"Prateek","family":"Jain"},{"given":"Siddhartha Reddy","family":"Jonnalagadda"},{"given":"Ming-Wei","family":"Chang"},{"given":"Iftekhar","family":"Naim"}],"DOI":"10.48550/ARXIV.2403.20327","type":"document","id":"https://doi.org/10.48550/arxiv.2403.20327","citation-key":"https://doi.org/10.48550/arxiv.2403.20327","issued":{"date-parts":[[2024]]},"keyword":"Computation and Language (cs.CL),Artificial Intelligence (cs.AI),FOS: Computer and information sciences,FOS: Computer and information sciences","publisher":"arXiv","title":"Gecko: Versatile Text Embeddings Distilled from Large Language Models","URL":"https://arxiv.org/abs/2403.20327","_graph":[{"type":"@biblatex/text","data":"@misc{https://doi.org/10.48550/arxiv.2403.20327,\n  doi = {10.48550/ARXIV.2403.20327},\n  url = {https://arxiv.org/abs/2403.20327},\n  author = {Lee, Jinhyuk and Dai, Zhuyun and Ren, Xiaoqi and Chen, Blair and Cer, Daniel and Cole, Jeremy R. and Hui, Kai and Boratko, Michael and Kapadia, Rajvi and Ding, Wen and Luan, Yi and Duddu, Sai Meher Karthik and Abrego, Gustavo Hernandez and Shi, Weiqiang and Gupta, Nithi and Kusupati, Aditya and Jain, Prateek and Jonnalagadda, Siddhartha Reddy and Chang, Ming-Wei and Naim, Iftekhar},\n  keywords = {Computation and Language (cs.CL), Artificial Intelligence (cs.AI), FOS: Computer and information sciences, FOS: Computer and information sciences},\n  title = {Gecko: Versatile Text Embeddings Distilled from Large Language Models},\n  publisher = {arXiv},\n  year = {2024},\n  copyright = {Creative Commons Attribution 4.0 International}\n}\n"},{"type":"@biblatex/entries+list"},{"type":"@csl/list+object"}]}]